{
  "manifest_version": "1.0",
  "generated_at": "2026-10-02T13:46:00.582486+00:00",
  "repository": {
    "name": "cozo-manifest-test",
    "url": "https://github.com/VKPveer/cozo-manifest-test.git",
    "branch": "main",
    "commit_sha": "d642e495367c92bde2f7de4f2b35e22d43359578"
  },
  "files": [
    {
      "path": "app.py",
      "name": "app.py",
      "extension": ".py",
      "type": "source",
      "language": "Python",
      "size": 5341,
      "hash": "f086bd26b305b5f2f0ca0c83bd5cbe8c775e10426faef02473780d7678b409f2",
      "last_modified": "2026-10-02T13:45:59.446520+00:00",
      "classes": [],
      "functions": [
        {
          "name": "load_seed_users",
          "signature": "load_seed_users()",
          "parameters": [],
          "async": false,
          "line_start": 30,
          "line_end": 43
        },
        {
          "name": "save_users",
          "signature": "save_users(users)",
          "parameters": [
            "users"
          ],
          "async": false,
          "line_start": 46,
          "line_end": 60
        },
        {
          "name": "create_demo_users",
          "signature": "create_demo_users(user_service,validation_service)",
          "parameters": [
            "user_service",
            "validation_service"
          ],
          "async": false,
          "line_start": 63,
          "line_end": 153
        },
        {
          "name": "print_user_report",
          "signature": "print_user_report(user_service,report_service)",
          "parameters": [
            "user_service",
            "report_service"
          ],
          "async": false,
          "line_start": 156,
          "line_end": 192
        },
        {
          "name": "update_demo_user",
          "signature": "update_demo_user(user_service)",
          "parameters": [
            "user_service"
          ],
          "async": false,
          "line_start": 195,
          "line_end": 223
        },
        {
          "name": "deactivate_demo_user",
          "signature": "deactivate_demo_user(user_service)",
          "parameters": [
            "user_service"
          ],
          "async": false,
          "line_start": 226,
          "line_end": 238
        },
        {
          "name": "search_demo_users",
          "signature": "search_demo_users(user_service)",
          "parameters": [
            "user_service"
          ],
          "async": false,
          "line_start": 241,
          "line_end": 259
        },
        {
          "name": "export_demo_users",
          "signature": "export_demo_users(user_service)",
          "parameters": [
            "user_service"
          ],
          "async": false,
          "line_start": 262,
          "line_end": 275
        },
        {
          "name": "generate_demo_reference",
          "signature": "generate_demo_reference()",
          "parameters": [],
          "async": false,
          "line_start": 278,
          "line_end": 289
        },
        {
          "name": "show_runtime_info",
          "signature": "show_runtime_info()",
          "parameters": [],
          "async": false,
          "line_start": 292,
          "line_end": 306
        },
        {
          "name": "main",
          "signature": "main()",
          "parameters": [],
          "async": false,
          "line_start": 309,
          "line_end": 385
        }
      ],
      "symbols": [
        {
          "symbol_type": "function",
          "name": "load_seed_users",
          "signature": "load_seed_users()",
          "parameters": [],
          "file": "app.py",
          "language": "Python",
          "line_start": 30,
          "line_end": 43
        },
        {
          "symbol_type": "function",
          "name": "save_users",
          "signature": "save_users(users)",
          "parameters": [
            "users"
          ],
          "file": "app.py",
          "language": "Python",
          "line_start": 46,
          "line_end": 60
        },
        {
          "symbol_type": "function",
          "name": "create_demo_users",
          "signature": "create_demo_users(user_service,validation_service)",
          "parameters": [
            "user_service",
            "validation_service"
          ],
          "file": "app.py",
          "language": "Python",
          "line_start": 63,
          "line_end": 153
        },
        {
          "symbol_type": "function",
          "name": "print_user_report",
          "signature": "print_user_report(user_service,report_service)",
          "parameters": [
            "user_service",
            "report_service"
          ],
          "file": "app.py",
          "language": "Python",
          "line_start": 156,
          "line_end": 192
        },
        {
          "symbol_type": "function",
          "name": "update_demo_user",
          "signature": "update_demo_user(user_service)",
          "parameters": [
            "user_service"
          ],
          "file": "app.py",
          "language": "Python",
          "line_start": 195,
          "line_end": 223
        },
        {
          "symbol_type": "function",
          "name": "deactivate_demo_user",
          "signature": "deactivate_demo_user(user_service)",
          "parameters": [
            "user_service"
          ],
          "file": "app.py",
          "language": "Python",
          "line_start": 226,
          "line_end": 238
        },
        {
          "symbol_type": "function",
          "name": "search_demo_users",
          "signature": "search_demo_users(user_service)",
          "parameters": [
            "user_service"
          ],
          "file": "app.py",
          "language": "Python",
          "line_start": 241,
          "line_end": 259
        },
        {
          "symbol_type": "function",
          "name": "export_demo_users",
          "signature": "export_demo_users(user_service)",
          "parameters": [
            "user_service"
          ],
          "file": "app.py",
          "language": "Python",
          "line_start": 262,
          "line_end": 275
        },
        {
          "symbol_type": "function",
          "name": "generate_demo_reference",
          "signature": "generate_demo_reference()",
          "parameters": [],
          "file": "app.py",
          "language": "Python",
          "line_start": 278,
          "line_end": 289
        },
        {
          "symbol_type": "function",
          "name": "show_runtime_info",
          "signature": "show_runtime_info()",
          "parameters": [],
          "file": "app.py",
          "language": "Python",
          "line_start": 292,
          "line_end": 306
        },
        {
          "symbol_type": "function",
          "name": "main",
          "signature": "main()",
          "parameters": [],
          "file": "app.py",
          "language": "Python",
          "line_start": 309,
          "line_end": 385
        }
      ],
      "dependencies": [
        {
          "name": "json",
          "type": "import",
          "category": "standard_library"
        },
        {
          "name": "os",
          "type": "import",
          "category": "standard_library"
        },
        {
          "name": "logging",
          "type": "import",
          "category": "standard_library"
        },
        {
          "name": "pathlib.Path",
          "type": "from_import",
          "category": "standard_library"
        },
        {
          "name": "datetime.datetime",
          "type": "from_import",
          "category": "standard_library"
        },
        {
          "name": "sample_service.UserService",
          "type": "from_import",
          "category": "internal"
        },
        {
          "name": "sample_service.UserValidationService",
          "type": "from_import",
          "category": "internal"
        },
        {
          "name": "sample_service.UserReportService",
          "type": "from_import",
          "category": "internal"
        },
        {
          "name": "sample_service.normalize_email",
          "type": "from_import",
          "category": "internal"
        },
        {
          "name": "sample_service.generate_reference",
          "type": "from_import",
          "category": "internal"
        }
      ]
    },
    {
      "path": "sample_service.py",
      "name": "sample_service.py",
      "extension": ".py",
      "type": "source",
      "language": "Python",
      "size": 5558,
      "hash": "cfa0d300c7d6bd34c3a0b80633214c3edf1879f7bebd58657a8cc16916465985",
      "last_modified": "2026-10-02T13:45:59.447520+00:00",
      "classes": [
        {
          "name": "UserService",
          "line_start": 6,
          "line_end": 264,
          "methods": [
            {
              "name": "__init__",
              "signature": "__init__(self)",
              "parameters": [
                "self"
              ],
              "async": false,
              "line_start": 8,
              "line_end": 12
            },
            {
              "name": "create_user",
              "signature": "create_user(self,name,email,role)",
              "parameters": [
                "self",
                "name",
                "email",
                "role"
              ],
              "async": false,
              "line_start": 15,
              "line_end": 44
            },
            {
              "name": "get_user",
              "signature": "get_user(self,user_id)",
              "parameters": [
                "self",
                "user_id"
              ],
              "async": false,
              "line_start": 47,
              "line_end": 54
            },
            {
              "name": "update_user",
              "signature": "update_user(self,user_id,name,email,role)",
              "parameters": [
                "self",
                "user_id",
                "name",
                "email",